{
  "schemaVersion": 1,
  "setId": "test-answer-too-long",
  "title": "answer文字数超過テスト",
  "questions": [
    {
      "id": "q1",
      "type": "freeText",
      "text": "問題",
      "answers": [
        "いいいいいいいいいいいいいいいいいいいいいいいいいいいいいいいいいいいいいいいいいいいいいいいいいいいいいいいいいいいいいいいいいいいいいいいいいいいいいいいいいいいいいいいいいいいいいいいいいいいいい"
      ]
    }
  ]
}